,COMPANY NAME,,BEYLERBEYI GENERAL TRADING LLC,,,,,,SOURCE COMPANY,,"Tianjin Kaigui Machinery Co.LTD,Tianjin, China",,,,,,TYPE OF TRANSACTION,,GOODS IN TRUST,,,,,,MONTH,,JANURARY  2019,,,,,,SUGGESTIONS:,,KINDLY USE EXPORTERS FROM ,,,,,,,,,,,,,,,,,,,,,,,,,,,,,,G-BBY-0108,24.01.2019,16953.00,EURO, BREACKER AG   ,SWITZERLAND,ENBD,,G-BBY-0130,27.01.2019,120670.00,EURO, CHEMEM COMPANY LIMITED   ,CHINA,ENBD,,G-BBY-0007,10.01.2019,192051.00,AED, CIELO OESTE GENERAL TRADING FZE                      ,"DUBAI, UAE",ENBD,,G-BBY-0053,08.01.2019,37514.00,EURO, CIOTOLA S.R.L   ,ITALY,ENBD,,G-BBY-0116,24.01.2019,1557.00,EURO, CRYSMIT PHOTONICS LIMITED,CHINA,ENBD,,G-BBY-0111,24.01.2019,8502.00,EURO, FALLER BARS LIMITED       ,UNITED KINGDOM,ENBD,,G-BBY-0038,06.01.2019,73515.00,EURO, GIT HONG KONG LIMITED      ,HONGKONG,ENBD,,G-BBY-0075,12.01.2019,37000.00,EURO, GREEN INDUSTRIES (HONG KONG) LIMITED,"HONGKONG, CHINA",ENBD,,G-BBY-0103,21.01.2019,106243.00,EURO, HAINING FUXING COMPUND NEW MATERIAL CO LTD,CHINA,ENBD,,G-BBY-0068,12.01.2019,29120.00,EURO," KUIBURI FRUIT CANNING CO, LTD",THAILAND,ENBD,,G-BBY-0126,26.01.2019,37700.00,EURO, LAMIGRAF S.A.U   ,SPAIN,ENBD,G-BBY-0056-CL,G-BBY-0054,08.01.2019,29940.00,EURO, MA. TE. CO. SRL  ,ITALY,ENBD,,G-BBY-0055,08.01.2019,16885.00,EURO, MA. TE. CO. SRL  ,ITALY,ENBD,,G-BBY-0056,08.01.2019,20190.00,EURO, MA. TE. CO. SRL  ,ITALY,ENBD,,G-BBY-0083,15.01.2019,14551.00,EURO, MANTRADE CORPORATION LIMITED  ,"HONGKONG, CHINA",ENBD,G-BBY-0140-CL,G-BBY-0133,29.01.2019,173267.00,EURO, MARFRIG GLOBAL FOODS S A,BRAZIL,ENBD,,G-BBY-0134,29.01.2019,214222.00,EURO, MARFRIG GLOBAL FOODS S A,BRAZIL,ENBD,,G-BBY-0140,30.01.2019,213244.00,EURO, MARFRIG GLOBAL FOODS S A      ,BRAZIL,ENBD,,G-BBY-0086,15.01.2019,24472.00,EURO, MONNO CORPORATION ,BANGALADESH,ENBD,G-BBY-0081-CL,G-BBY-0070,12.01.2019,31739.00,EURO, NINGBO ACCU ELECTRIC DEVICES INDUSTRY CO LTD,CHINA,ENBD,,G-BBY-0081,14.01.2019,43190.00,EURO, NINGBO ACCU ELECTRIC DEVICES INDUSTRY CO LTD,CHINA,ENBD,,G-BBY-0051,08.01.2019,28000.00,EURO, NOVATEK GENERAL TRADING LLC ,"DUBAI, UAE",ENBD,,G-BBY-0045,06.01.2019,36996.00,EURO, PAREX WARENHANDELSGESELLSCHAFT MBH,AUSTRIA,ENBD,,G-BBY-0021,21.01.2019,340710.00,AED, PHOENIX TYRES TRADING F.Z.E  ,"DUBAI, UAE",ENBD,,G-BBY-0112,24.01.2019,2799.00,EURO, SAURER TECHNOLOGIES GMBH & CO. KG  ,GERMANY,ENBD,,G-BBY-0097,21.01.2019,34345.00,EURO, SH CHEMICAL GROUP LIMITED,CHINA,ENBD,,G-BBY-0029,05.01.2019,63860.00,EURO, SHENZHEN CHENSU INTERNATIONAL TRADE CO. LTD,CHINA,ENBD,G-BBY-0018-CL,G-BBY-0017,21.01.2019,375966.00,AED, SYED NAEEM GENERAL TRADING CO LLC   ,"DUBAI, UAE",ENBD,,G-BBY-0018,21.01.2019,375966.00,AED, SYED NAEEM GENERAL TRADING CO LLC   ,"DUBAI, UAE",ENBD,,G-BBY-0040,06.01.2019,51760.00,EURO, WEIHUI TRADING CO LIMITED  ,CHINA,ENBD,,G-BBY-0123,26.01.2019,30000.00,EURO, YILI (HONG KONG) TECHNOLOGY CORPORATION LTD,"HONGKONG, CHINA",ENBD,,G-BBY-0093,21.01.2019,13112.00,EURO,ABP ELECTRONICS LIMITED  ,CHINA,ENBD,,G-BBY-0031,05.01.2019,60630.00,EURO,ADRIATICA SPA              ,ITALY,ENBD,,G-BBY-0084,15.01.2019,13000.00,EURO,AHYAN JUTE MILLS LIMITED           ,BANGALADESH,ENBD,,G-BBY-0096,21.01.2019,12019.00,EURO,AISPEED INDUSTRY LIMITED ,CHINA,ENBD,,G-BBY-0030,05.01.2019,29820.00,EURO,AKIJ JUTE MILLS LTD,BANGALADESH,ENBD,,G-BBY-0060,08.01.2019,37897.00,EURO,ANOTEC GMBH,GERMANY,ENBD,,G-BBY-0005,06.01.2019,1149512.00,AED,ANVERALLY & SONS PVT LTD  ,SRILANKA,ENBD,G-BBY-0034-CL,G-BBY-0033,05.01.2019,95551.00,EURO,ARGOS IMPORT & EXPORT CO LTD   ,CHINA,ENBD,,G-BBY-0034,05.01.2019,76440.00,EURO,ARGOS IMPORT & EXPORT CO LTD   ,CHINA,ENBD,,G-BBY-0127,26.01.2019,28098.00,EURO,ARKO ENTERPRISE,"MUMBAI, INDIA",ENBD,,G-BBY-0027,31.01.2019,474407.00,AED,ARMACO GENERAL TRADING LLC,"DUBAI, UAE",ENBD,,G-BBY-0066,12.01.2019,9250.00,EURO,AVIN ELECTRONIC TECHNOLOGY CO.LTD ,"HONGKONG, CHINA",ENBD,,G-BBY-0094,21.01.2019,72028.00,EURO,BENTLEY INNOMED GMBH ,GERMANY,ENBD,,G-BBY-0013,19.01.2019,1785241.00,AED,BEYZADE GENERAL TRADING,"DUBAI, UAE",ENBD,,G-BBY-0014,19.01.2019,1563018.00,AED,BEYZADE GENERAL TRADING,"DUBAI, UAE",ENBD,,G-BBY-0015,19.01.2019,1651741.00,AED,BEYZADE GENERAL TRADING,"DUBAI, UAE",ENBD,,G-BBY-0119,26.01.2019,27800.00,EURO,BIOCHEMICAL SYSTEMS INTERNATIONAL S.P.A,ITALY,ENBD,,G-BBY-0142,09.01.2019,165972.00,AED,CASH WITHDRAWAL                                   ,,CBD,,G-BBY-0109,24.01.2019,12411.00,EURO,CHEN WELL (HONG KONG) LIMITED   ,"HONGKONG, CHINA",ENBD,G-BBY-0050-CL,G-BBY-0041,06.01.2019,70000.00,EURO,"CHIANGRAI FROZEN FOODS CO.,LTD  ",THAILAND,ENBD,,G-BBY-0049,07.01.2019,70000.00,EURO,"CHIANGRAI FROZEN FOODS CO.,LTD  ",THAILAND,ENBD,,G-BBY-0050,07.01.2019,69488.00,EURO,"CHIANGRAI FROZEN FOODS CO.,LTD  ",THAILAND,ENBD,,G-BBY-0114,24.01.2019,11053.00,EURO,"CHINA AMAZONA MACHINERY CO., LIMITED",CHINA,ENBD,G-BBY-0107-CL,G-BBY-0091,19.01.2019,223108.00,EURO,CHINA OCEAN SHIPPING AGENCY CO LTD,CHINA,ENBD,,G-BBY-0107,24.01.2019,224350.00,EURO,CHINA OCEAN SHIPPING AGENCY CO LTD,CHINA,ENBD,,G-BBY-0047,06.01.2019,4573.00,EURO,CNTIC TIANJIN IMPORT & EXPORT CO LTD,CHINA,ENBD,,G-BBY-0113,24.01.2019,6963.00,EURO,CONTARINI LEOPOLDO SRL   ,ITALY,ENBD,G-BBY-0117-CL,G-BBY-0117,24.01.2019,22173.00,EURO,D.B INDUSTRIAL LTD   ,U S A,ENBD,,G-BBY-0079,14.01.2019,40376.00,EURO,D.B INDUSTRIAL LTD           ,U S A,ENBD,,G-BBY-0074,12.01.2019,39063.00,EURO,DBI TRADING AND CONSULTING LIMITED   ,"HONGKONG, CHINA",ENBD,,G-BBY-0110,24.01.2019,4144.00,EURO,DELTAMIX INTERNATIONAL TRADING ,CHINA,ENBD,,G-BBY-0065,12.01.2019,7400.00,EURO,DESITIN ARZNEIMITTEL GMBH  ,GERMANY,ENBD,,G-BBY-0057,08.01.2019,64440.00,EURO,DIHB DEUTSCH-INTERNATIONALE HANDELSBEZIEHUNGEN GMBH,GERMANY,ENBD,,G-BBY-0071,12.01.2019,21487.00,EURO,EUROPEAN MUD COMPANY AS,NORWAY,ENBD,,G-BBY-0137,29.01.2019,200982.00,EURO,EZM EDELSTAHLZIEHEREI MARK GMBH,GERMANY,ENBD,,G-BBY-0089,19.01.2019,283798.00,EURO,FASSKA PAR S.A,BELGIUM,ENBD,,G-BBY-0032,05.01.2019,14520.00,EURO,FLUIDMASTER PREDELAVA PLASTIKE D.O.O.,SLOVENIA,ENBD,,G-BBY-0019,21.01.2019,294895.00,AED,GALAXY SUN TELECOM LLC    ,"DUBAI, UAE",ENBD,,G-BBY-0036,05.01.2019,115000.00,EURO,GIOELLI DI MENICHELLI FRANCO AND C SRL  ,ITALY,ENBD,,G-BBY-0115,24.01.2019,8535.00,EURO,GULF LINE INTERNATIONAL TRADING COMPANY LLC,"DUBAI, UAE",ENBD,G-BBY-0009-CL,G-BBY-0008,15.01.2019,136235.00,AED,HABIB MUHAMMAD SIDDIQUE FOOD AND BEVERAGE LLC,"DUBAI, UAE",ENBD,,G-BBY-0009,15.01.2019,280217.00,AED,HABIB MUHAMMAD SIDDIQUE FOOD AND BEVERAGE LLC,"DUBAI, UAE",ENBD,,G-BBY-0124,26.01.2019,22689.00,EURO,"HK HUA CHENG ELECTRONICS CO., LTD      ",CHINA,ENBD,,G-BBY-0044,06.01.2019,5488.00,EURO,ITAL PHARCHEM S.R.L ,ITALY,ENBD,,G-BBY-0121,26.01.2019,37226.00,EURO,JOINT RESOURCES TECHNOLOGY DEVELOPMENT LTD,"HONGKONG, CHINA",ENBD,,G-BBY-0095,21.01.2019,35303.00,EURO,KAIDA HOLDING LIMITED,CHINA,ENBD,,G-BBY-0020,21.01.2019,682287.00,AED,KARJI GENERAL TRADING ESTABLISHMENT,"DUBAI, UAE",ENBD,,G-BBY-0037,06.01.2019,277500.00,EURO,KLADEX LIMITED         ,UNITED KINGDOM,ENBD,,G-BBY-0004,06.01.2019,1739653.00,AED,KMG ROBUST COMMODITY DMCC,"DUBAI, UAE",ENBD,G-BBY-0104-CL,G-BBY-0088,19.01.2019,225456.00,EURO,LONG SHUN ENTERPRISE CO LIMITED,"HONGKONG, CHINA",ENBD,,G-BBY-0092,20.01.2019,200124.00,EURO,LONG SHUN ENTERPRISE CO LIMITED,"HONGKONG, CHINA",ENBD,,G-BBY-0102,21.01.2019,220460.00,EURO,LONG SHUN ENTERPRISE CO LIMITED,"HONGKONG, CHINA",ENBD,,G-BBY-0104,23.01.2019,325444.00,EURO,LONG SHUN ENTERPRISE CO LIMITED,"HONGKONG, CHINA",ENBD,,G-BBY-0138,30.01.2019,250300.00,EURO,LONG SHUN ENTERPRISE CO LIMITED,"HONGKONG, CHINA",ENBD,,G-BBY-0139,30.01.2019,211125.00,EURO,MATTEO INTERNATIONAL TRADE CO LTD,"HONGKONG, CHINA",ENBD,,G-BBY-0022,21.01.2019,330428.00,AED,MEDIST FZE  ,"DUBAI, UAE",ENBD,,G-BBY-0136,29.01.2019,274321.00,EURO,MERIBEL TRADE CO LIMITED,"HONGKONG, CHINA",ENBD,,G-BBY-0039,06.01.2019,37252.00,EURO,MGK CHEM INDUSTRY COMPANY LIMITED,USA,ENBD,,G-BBY-0069,12.01.2019,28667.00,EURO,MINDA KOTA SDN BHD  ,MALAYSIA,ENBD,,G-BBY-0011,19.01.2019,247314.00,AED,MOHAMED RUYAN MEDICAL EQUIPMENT TRADING,"DUBAI, UAE",ENBD,,G-BBY-0085,15.01.2019,13000.00,EURO,NAHAR TRADING INTERNATIONAL,BANGALADESH,ENBD,,G-BBY-0080,14.01.2019,63480.00,EURO,"NINGBO YOUNGOR INTERNATIONAL TRADE & TRANSPORTATION CO., LTD.",CHINA,ENBD,G-BBY-0087-CL,G-BBY-0076,14.01.2019,347985.00,EURO,PAS PRIMARY AUTOMOTIVE SUPPORT GMBH,GERMANY,ENBD,,G-BBY-0087,19.01.2019,347985.00,EURO,PAS PRIMARY AUTOMOTIVE SUPPORT GMBH,GERMANY,ENBD,,G-BBY-0059,08.01.2019,63912.00,EURO,PEYER GRAPHIZ AG,SWITZERLAND,ENBD,,G-BBY-0058,08.01.2019,41905.00,EURO,PHOENIX HANDELS- UND DEVELOPMENT-GMBH,GERMANY,ENBD,,G-BBY-0100,21.01.2019,12927.00,EURO,PHOENIX RUBBER PRODUCT CO : LTD        ,THAILAND,ENBD,,G-BBY-0063,10.01.2019,5000.00,EURO,PIONIER BIOINSTRUMENTE GMBH    ,AUSTRIA,ENBD,,G-BBY-0101,21.01.2019,162554.00,EURO,"QINGDAO DOUBLESTAR TIRE INDUSTRIAL CO.,",CHINA,ENBD,,G-BBY-0118,26.01.2019,39930.00,EURO,RAXLAB E.K,GERMANY,ENBD,,G-BBY-0061,10.01.2019,3132.00,EURO,RKB EUROPE SA      ,SWITZERLAND,ENBD,,G-BBY-0042,06.01.2019,95000.00,EURO,RMT VALVOMECCANICA SRL ,ITALY,ENBD,,G-BBY-0099,21.01.2019,8949.00,EURO,"SHANGHAI INTCO IMPORT & EXPORT CO., LTD",CHINA,ENBD,,G-BBY-0028,05.01.2019,7568.00,EURO,SHANGHAI ORTHO KING MEDICAL DEVICE CO. LTD,CHINA,ENBD,,G-BBY-0122,26.01.2019,32414.00,EURO,SHENZHEN SUNSHINE OPTO - ELECTRONICS TECHNOLOGY LTD,CHINA,ENBD,G-BBY-0077-CL,G-BBY-0064,12.01.2019,375108.00,EURO,SIC INVENT AG   ,SWITZERLAND,ENBD,,G-BBY-0077,14.01.2019,376403.00,EURO,SIC INVENT AG   ,SWITZERLAND,ENBD,,G-BBY-0006,06.01.2019,2694875.00,AED,SIG COMBIBLOC OEBEIKAN FZCO,"DUBAI, UAE",ENBD,,G-BBY-0010,16.01.2019,2500000.00,AED,SILVER POOL GENERAL TRADING,"DUBAI, UAE",ENBD,,G-BBY-0098,21.01.2019,17173.00,EURO,"SINOBRIGHT PHARMA CO., LIMITED         ",CHINA,ENBD,,G-BBY-0131,27.01.2019,63100.00,EURO,STORZ MEDICAL AG,SWITZERLAND,ENBD,,G-BBY-0043,06.01.2019,121500.00,EURO,"SUN SWEET CO., LTD   ",THAILAND,ENBD,G-BBY-0025-CL,G-BBY-0012,19.01.2019,2543259.00,AED,SURAWUT THIANGLE TRADING LLC                      ,"DUBAI, UAE",ENBD,,G-BBY-0024,22.01.2019,1601706.00,AED,SURAWUT THIANGLE TRADING LLC                      ,"DUBAI, UAE",ENBD,,G-BBY-0025,22.01.2019,1398294.00,AED,SURAWUT THIANGLE TRADING LLC                      ,"DUBAI, UAE",ENBD,,G-BBY-0072,12.01.2019,34320.00,EURO,TAECHIN SMET CORPORATION,KOREA,ENBD,,G-BBY-0135,29.01.2019,50000.00,EURO,TAIWAN BE CHARM TRADING CO LIMITED,"HONGKONG, CHINA",ENBD,,G-BBY-0120,26.01.2019,30432.00,EURO,"TAIZHOU DARTS MACHINERY TRADE CO., LTD",CHINA,ENBD,,G-BBY-0023,21.01.2019,501284.00,AED,TAJ AL MULOOK GENERAL TRADING LLC ,"DUBAI, UAE",ENBD,G-BBY-0128-CL,G-BBY-0105,24.01.2019,225556.00,EURO,TCL HOME APPLIANCES (HEFEI) ,CHINA,ENBD,,G-BBY-0106,24.01.2019,226653.00,EURO,TCL HOME APPLIANCES (HEFEI) ,CHINA,ENBD,,G-BBY-0128,27.01.2019,247458.00,EURO,TCL HOME APPLIANCES (HEFEI) ,CHINA,ENBD,,G-BBY-0035,05.01.2019,73900.00,EURO,TEXACHEM INTERNATIONAL SRL           ,ITALY,ENBD,,G-BBY-0016,20.01.2019,700000.00,AED,THE WATCH FZ LLC   ,"DUBAI, UAE",ENBD,,G-BBY-0067,12.01.2019,11850.00,EURO,TIANJIN LZYUN ENVIRONMENTAL TECHNOLOGY ,CHINA,ENBD,G-BBY-0002-CL,G-BBY-0001,03.01.2019,1924745.00,AED,TOP PACIFIC TRADING LLC ,"DUBAI, UAE",ENBD,,G-BBY-0002,03.01.2019,2075255.00,AED,TOP PACIFIC TRADING LLC ,"DUBAI, UAE",ENBD,,G-BBY-0003,05.01.2019,3000000.00,AED,TRANSCOR B.V  ,NETHERLANDS,ENBD,,G-BBY-0090,19.01.2019,170200.00,EURO,TRENT DENT PRODUCTS LTD ,UNITED KINGDOM,ENBD,,G-BBY-0026,22.01.2019,2245741.00,AED,TURAN TRADING FZE                                 ,"DUBAI, UAE",ENBD,,G-BBY-0082,15.01.2019,11225.00,EURO,UTIEN PACK CO LIMITED,CHINA,ENBD,,G-BBY-0132,29.01.2019,212700.00,EURO,WELCRON KANGWON CO LTD  ,SOUTH KOREA,ENBD,,G-BBY-0062,10.01.2019,30362.00,EURO,WYLEGARNIA RYB DABIE,POLAND,ENBD,,G-BBY-0125,26.01.2019,63566.00,EURO,YANGTIAN GENERAL TRADING CO LIMITED,"HONGKONG, CHINA",ENBD,G-BBY-0048-CL,G-BBY-0046,06.01.2019,59682.00,EURO,ZHANGJIAGANG HUAMING MACHINERY CO LTD  ,CHINA,ENBD,,G-BBY-0048,07.01.2019,59680.00,EURO,ZHANGJIAGANG HUAMING MACHINERY CO LTD  ,CHINA,ENBD,G-BBY-0078-CL,G-BBY-0052,08.01.2019,26082.00,EURO,ZHEJIANG THREE CHILDREN FOOD CO LTD,CHINA,ENBD,,G-BBY-0078,14.01.2019,65205.00,EURO,ZHEJIANG THREE CHILDREN FOOD CO LTD,CHINA,ENBD,,G-BBY-0073,12.01.2019,30029.00,EURO,"ZHONGSHAN YUANAN IMPORT AND EXPORT CO.,",CHINA,ENBD,,,,,,,,,,G-BBY-0078-CL,08.01.2019,91287.00,EURO,ZHEJIANG THREE CHILDREN FOOD CO LTD,CHINA,ENBD,,G-BBY-0048-CL,06.01.2019,119362.00,EURO,ZHANGJIAGANG HUAMING MACHINERY CO LTD  ,CHINA,ENBD,,G-BBY-0002-CL,03.01.2019,4000000.00,AED,TOP PACIFIC TRADING LLC ,"DUBAI, UAE",ENBD,,G-BBY-0128-CL,24.01.2019,699667.00,EURO,TCL HOME APPLIANCES (HEFEI) ,CHINA,ENBD,,G-BBY-0025-CL,19.01.2019,5543259.00,AED,SURAWUT THIANGLE TRADING LLC                      ,"DUBAI, UAE",ENBD,,G-BBY-0077-CL,12.01.2019,751511.00,EURO,SIC INVENT AG   ,SWITZERLAND,ENBD,,G-BBY-0087-CL,14.01.2019,695970.00,EURO,PAS PRIMARY AUTOMOTIVE SUPPORT GMBH,GERMANY,ENBD,,G-BBY-0104-CL,19.01.2019,971484.00,EURO,LONG SHUN ENTERPRISE CO LIMITED,"HONGKONG, CHINA",ENBD,,G-BBY-0009-CL,15.01.2019,416452.00,AED,HABIB MUHAMMAD SIDDIQUE FOOD AND BEVERAGE LLC,"DUBAI, UAE",ENBD,,G-BBY-0117-CL,14.01.2019,62549.00,EURO,D.B INDUSTRIAL LTD   ,U S A,ENBD,,G-BBY-0107-CL,19.01.2019,447458.00,EURO,CHINA OCEAN SHIPPING AGENCY CO LTD,CHINA,ENBD,,G-BBY-0050-CL,06.01.2019,209488.00,EURO,"CHIANGRAI FROZEN FOODS CO.,LTD  ",THAILAND,ENBD,,G-BBY-0034-CL,05.01.2019,171991.00,EURO,ARGOS IMPORT & EXPORT CO LTD   ,CHINA,ENBD,,G-BBY-0018-CL,21.01.2019,751932.00,AED, SYED NAEEM GENERAL TRADING CO LLC   ,"DUBAI, UAE",ENBD,,G-BBY-0081-CL,12.01.2019,74929.00,EURO, NINGBO ACCU ELECTRIC DEVICES INDUSTRY CO LTD,CHINA,ENBD,,G-BBY-0140-CL,29.01.2019,600733.00,EURO, MARFRIG GLOBAL FOODS S A,BRAZIL,ENBD,,G-BBY-0056-CL,08.01.2019,67015.00,EURO, MA. TE. CO. SRL  ,ITALY,ENBD,
